Postal Code;Latitude;Longitude;Sample Address;Sample Employer
J7E4H5;45.6279579;-73.8905845;34 Leguerrier Street, Blainville, QC J7E4H5;Denis Leguerrier Fils et Fille Senc
G0A3Z0;46.87336879999999;-71.013784;1580, cte Thiverge, Saint-Laurent, QC G0A3Z0;Denis Thivierge Maraicher inc
H2Y2R6;45.5025982;-73.5571272;465 Saint-Jean Street, Suite1001, Montreal, QC H2Y2R6;Design Shopp
H9R5P4;45.4620424;-73.8176847;181 Hymus Boulevard, Suite100, Pointe-Claire, QC H9R5P4;Diabsolut Inc.
H3K1T6;45.4741287;-73.56268009999999;2650 Rushbrooke Street, Montreal, QC H3K1T6;Diffusion Panda inc.
H3A1X6;45.5010968;-73.5733496;1500 Metcalfe Street, Suite900, Montreal, QC H3A1X6;Distribution Hamaix Inc.
H2Y1C9;45.5107084;-73.55239089999999;465 Notre-Dame Street East, Suite617, Montreal, QC H2Y1C9;Divertissement Groupe Pure Inc.
H2S3L5;45.5298171;-73.5984043;5800 Saint-Denis Street, Suite1001, Montreal, QC H2S3L5;Divertissements Gameloft Inc.
H2R2Z5;45.53210319999999;-73.6221827;7250 Marconi Street, Montreal, QC H2R2Z5;Divertissements Gameloft Inc.
H4N3H8;45.5262645;-73.6586702;265 Lebeau Boulevard, Saint-Laurent, QC H4N3H8;DK Company Canada Inc.
G7A2M8;46.6820613;-71.33418279999999;1060, chemin Olivier, Saint-Nicolas, QC G7A2M8;DK-SPEC Inc
H7Y1T6;45.5282493;-73.8576152;1464 De Val-Brillant Street, Laval, QC H7Y1T6;Doggiestyle Pet Store Ltd. o/a Bark and Fitz
J4X1R9;45.4509733;-73.47203;1645, croissant de la Sibrie, Brossard, QC J4X1R9;Dollar ou Deux plus
H4P0A1;45.4913368;-73.6730841;5805 Royalmount Avenue, Montreal, QC H4P0A1;Dollarama LP
J0E1M0;45.1521432;-72.8238764;4470, chemin Godbout, Dunham, QC J0E1M0;Domaine De Dunham Inc.
H9P1A6;45.4657722;-73.7183079;10315, chemin de la Cte-de-Liesse, Dorval, QC H9P1A6;Domaine de la Cte Mont-Rigaud inc.
J0B2T0;45.7918436;-72.20233259999999;68, route 243, PO Box232, Saint-Flix-de-Kingsey, QC J0B2T0;Domaine de la Role Senc.
H2T3E6;45.5253944;-73.5914811;201 Laurier Avenue East, Montreal, QC H2T3E6;Domaine des Ctes d'Ardoises (2010) inc.
J3P2M2;46.0167042;-73.1280249;1000, chemin des Patriotes, Sorel-Tracy, QC J3P2M2;Domaine du Chteau Langelier
G0X3B0;46.3648493;-72.90961349999999;265, rang Saint-Franois, Saint-Svre, QC G0X3B0;Domaine et Vins Glinas inc.
J0E1S0;45.276669;-72.57061929999999;285, chemin Brome, Lac Brome, QC J0E1S0;Domaine Les Brome
J0N1M0;45.5339469;-74.0279695;1335, chemin Principal, Saint-Joseph-du-Lac, QC J0N1M0;Dulbecco Aude et Vincent Marc
H2Y2G1;45.5001049;-73.557395;438 McGill Street, Suite200, Montreal, QC H2Y2G1;Dulcedo Inc.
H4P1R3;45.49404080000001;-73.6575005;5420 Par Street, Montreal, QC H4P1R3;Dynapompe
G0C3B0;48.4304019;-64.4412574;405, route 132, Sainte-Thrse, QC G0C3B0;E. Gagnon et Fils Lte
H3N2C7;45.5264631;-73.6188008;6855 De L'pe Avenue, Suite200, Montreal, QC H3N2C7;Ebix Inc / A.D.A.M.
H3K1G6;45.4842929;-73.56191319999999;1751 Richardson Street, Suite1505, Montreal, QC H3K1G6;clairage Lumenpulse Inc
H3B1A2;45.50564989999999;-73.56705239999999;372 Sainte-Catherine Street West, Suite211, Montreal, QC H3B1A2;cole de danse contemporaine de Montral
J0K1K0;46.0936015;-73.4590419;4680 Principale Street, Lourdes, Joliette, QC J0K1K0;cole de parachutisme Voltige 2001
H2J2L8;45.5263635;-73.5888161;5030 Saint-Denis Street, Montreal, QC H2J2L8;Ecole Nationale De Theatre
H2Y2M2;45.5013149;-73.5566283;404 Saint-Pierre Street, Suite302, Montreal, QC H2Y2M2;cole Satyam De Hatha Yoga
G1K3W1;46.8167866;-71.2073161;160 Saint-Paul Street, Suite200, Quebec, QC G1K3W1;Econoler International Inc.
G1K3M8;46.8123568;-71.22460030000001;395 Victor-Revillon Street, Qubec, QC G1K3M8;Effets Spciaux Frima Inc.
H1Y3L1;45.5418292;-73.56387889999999;4101 Molson Street, Suite400, Montreal, QC H1Y3L1;Effigis Go-Solutions Inc.
G8V1W4;46.4037297;-72.5295388;2965 Des Prairies Street, Trois-Rivires, QC G8V1W4;EFG Excavation Inc
H3A2R7;45.5020223;-73.5755252;1010 Sherbrooke Street West, Montreal, QC H3A2R7;Efront solutions financires inc.
J0B1M0;45.41406500000001;-71.56246539999999;345, chemin Brochu, Cookshire, QC J0B1M0;glise Essnienne Chrtienne
H4S1G3;45.4853909;-73.7275021;1515 Pitfield Boulevard, Montreal, QC H4S1G3;EliMetal Inc.
H8T1A3;45.4656588;-73.71649699999999;10330, chemin de la Cte-de-Liesse, Montreal, QC H8T1A3;Elisen & Associs inc.
J8T5T7;45.4875519;-75.70227609999999;455 Grber Boulevard, SuiteE, Gatineau, QC J8T5T7;Elyo Shawarma
J7V8P7;45.41898219999999;-74.0091817;21919, chemin Dumberry, Vaudreuil-Dorion, QC J7V8P7;Emballages Winpak Heat Seal Inc./Les
H2V4L5;45.5293515;-73.61375289999999;6640 De l'Esplanade Avenue, Montreal, QC H2V4L5;E-Media Dynamo Inc
J0P1S0;45.3514896;-74.23760489999999;743, route 201, Saint-Clet, QC J0P1S0;Endives J.M.S. Inc
H3B5M2;45.5011278;-73.56432909999999;700 De La Gauchetire Street West, Suite1200, Montreal, QC H3B5M2;Enercon Canada Inc.
H3A2M8;45.501162;-73.5768698;1130 Sherbrooke Street West, 15th Floor, Montreal, QC H3A2M8;Enerkem Inc.
J7K3T9;45.74500399999999;-73.611492;884 De Maupassant Avenue, Mascouche, QC J7K3T9;Entreprise Acricole les Trois Versants
J0L1H0;45.0793007;-73.61523079999999;431, route202, Hemmingford, QC J0L1H0;Entreprise Agricole Petch Inc
J0H1L0;45.5896046;-72.8377933;1983 Principale Street, Saint-Dominique, QC J0H1L0;Entreprise Dubreuil inc
J1M1Z3;45.365771;-71.84892789999999;PO Box 111, STN Lennoxville, Sherbrooke, QC J1M1Z3;Entreprises Cedric Cleary
G2K1H3;46.857978;-71.32339680000001;1772 Bastien Boulevard, Qubec, QC G2K1H3;Entreprises Paysagres Olympique (Les)
H7R6C7;45.5366104;-73.87205179999999;2269, chemin de Saint-Antoine, Laval, QC H7R6C7;Enviro-Experts
J0T1M0;46.169802;-74.7515542;1281, chemin de la Station, La Conception, QC J0T1M0;Envirofort Inc.
H8S3R3;45.43902509999999;-73.68045459999999;551, 18e Avenue, Lachine, QC H8S3R3;Eolis Communications Inc.
G1N1P1;46.8090013;-71.24390199999999;652 Saint-Ignace Street, Qubec, QC G1N1P1;picerie Montagne Dore
G7H5A8;48.4685425;-71.0047117;840 Tadoussac Boulevard, Canton-Tremblay, QC G7H5A8;Equipement Comact
G7K1H1;48.3978634;-71.11569969999999;1846 Des Outardes Street, Chicoutimi, QC G7K1H1;Ergofab Inc.
H4P2N2;45.5001286;-73.66500610000001;8400 Dcarie Boulevard, Ville Mont-Royal, QC H4P2N2;Ericsson Canada Inc.
J0P1Z0;45.2464904;-74.27707149999999;1106 Principale Street, Saint-Zotique, QC J0P1Z0;Espace Vert Fourdinier (9163-2182 Qc)
H2R2N1;45.5410099;-73.61432809999999;7234 Saint-Hubert Street, Montreal, QC H2R2N1;Essence de Beaut Inc.
G0M1S0;45.9529749;-70.9863122;104 Du Parc Industriel Street, Saint-variste, QC G0M1S0;Estampro Inc
J6X4J6;45.7247662;-73.6863759;3382 Jacob-Jordan Street, SuiteC, Terrebonne, QC J6X4J6;Eugnie Canada inc.
J5R6Z7;45.3701087;-73.52225039999999;305 Libert Avenue, Candiac, QC J5R6Z7;Euro-Excellence LS Distribution
H2X2X8;45.5150042;-73.57331359999999;3675 Saint-Dominique Street, Montreal, QC H2X2X8;Exolnet
H2Y1V7;45.5054221;-73.5555123;63 Brsoles Street, Suite100, Montreal, QC H2Y1V7;Expedia Canada Corp.
J0G1P0;45.8861095;-73.1197026;2264, rang de la Basse, Saint-Ours, QC J0G1P0;Exploitation Diego Inc.
J2J1J6;45.3943172;-72.77652139999999;985 Andr-Line Street, Granby, QC J2J1J6;Ezeflow Inc.
H2N1P4;45.5447192;-73.65453939999999;9494 Saint-Laurent Boulevard, Suite606, Montreal, QC H2N1P4;Fabrique Maro
J7R7G6;45.56749689999999;-73.91422439999999;440 Du Parc Street, Saint-Eustache, QC J7R7G6;FACC Solutions Canada Inc
H3B2G2;45.5007519;-73.56947079999999;5, place Ville-Marie, Suite1045, Montreal, QC H3B2G2;Facilit Conseils et Solutions Inc.
J2S7C6;45.6234751;-72.949617;3200 Sicotte Street, PO Box5000, Saint-Hyacinthe, QC J2S7C6;Facult de mdecine vtrinaire de l'Universit de Montral
G5A1X7;47.6186944;-70.1480035;181 Richelieu Street, La Malbaie, QC G5A1X7;Fairmont Le Manoir Richelieu
H4M2X5;45.49745009999999;-73.699372;9999 Cavendish Boulevard, Suite350, Saint-Laurent, QC H4M2X5;Famic Technologies Inc.
H2J2L5;45.5252392;-73.58529009999999;4683 Saint-Denis Street, Montreal, QC H2J2L5;Fauchois Fleurs
H2Y1Y3;45.5009679;-73.5570949;350 Le Moyne Street, Suite100, Montreal, QC H2Y1Y3;Flix and Paul Studios
J0K1E0;45.991333;-73.2335727;155, rang Saint-Jean-Baptiste, Lanoraie, QC J0K1E0;Ferdinand Hervieux Inc.
G0Y1P0;45.8004073;-71.3028626;969, chemin Stratford, Stratford, QC G0Y1P0;Ferme M&J.G Couture inc
G0S3A0;46.3217677;-70.6579014;159, rang 8 Ouest, Saint-Odilon, QC G0S3A0;Ferme A. St-Hilaire senc
J2Y1H5;45.2768254;-73.3751425;982, chemin des Patriotes Ouest, Saint-Jean-sur-Richelieu, QC J2Y1H5;FERME AGRI-BOEUF SENC
J5T3K5;45.9330759;-73.31379179999999;192, rang Saint-Franois, Lavaltrie, QC J5T3K5;Ferme Alain Brissette Inc.
J0S1L0;45.034825;-74.44135249999999;7045, chemin Ridge, Dundee, QC J0S1L0;Ferme Alfred J Latulipe Inc.
G0R3E0;46.6694941;-71.0525291;266, chemin Boisclair, Saint-Henri, QC G0R3E0;Ferme Algrio inc.
J0S1T0;45.203139;-74.0056563;202, rang du Cinq, Saint-Louis-de-Gonzague, QC J0S1T0;Ferme Andre Laberge Inc
J7N2B4;45.6241806;-74.03289079999999;12391, cte des Bouchard, Mirabel, QC J7N2B4;Ferme Andre Locas et Fils
J0L2J0;45.2172435;-73.5738001;1986 Principale Street, Saint-Michel, QC J0L2J0;Ferme Andr Monchamps et Fils
J0J2E0;45.1242885;-73.3362484;360, rang Saint-Georges, Saint-Valentin, QC J0J2E0;FERME ARWIJK S.E.N.C
J0C1M0;46.1003172;-72.35224719999999;105, rang 7, Saint-Lonard-d'Aston, QC J0C1M0;Ferme Aston Inc.
J0V1W0;45.7337261;-75.05312169999999;1038, rang Sainte-Madeleine, Saint-Andr-Avellin, QC J0V1W0;Ferme aux Pleines Saveurs senc
J0H1C0;45.8389574;-73.06648199999999;472 Principale Street, Saint-Bernard-de-Michaudville, QC J0H1C0;Ferme Avicole B. Morin & Fils Inc.
J0S1R0;45.11129630000001;-73.7684014;76, rang Saint-Joseph, Saint-Chrysostome, QC J0S1R0;Ferme avicole MLG Bourdeau Inc.
G0A3P0;46.9598807;-70.9613269;4341, chemin Royal, Qubec, QC G0A3P0;Ferme Avicole Orlans inc.
J5M1Y6;45.85111879999999;-73.72064279999999;739, rang de la Rivire Nord, Saint-LinLaurentides, QC J5M1Y6;Ferme Bastien Inc.
J0L2A0;45.295507;-73.6807156;405, rang Saint-Simon, Saint-Isidore, QC J0L2A0;Ferme Bayel inc.
J0K3A0;46.1445113;-73.53799189999999;1160, rang 2, Sainte-Mlanie, QC J0K3A0;Ferme Beaulieu Gaetan & Fils Inc
G0A2R0;46.7209207;-71.59438299999999;1308, route 138, Neuville, QC G0A2R0;Ferme Bland & Fille inc. (9242-7277 Qubec inc)
J7N2T8;45.6205021;-74.07495899999999;9631 Arthur-Sauv Boulevard, Mirabel, QC J7N2T8;Ferme Belle-Rivire S.E.N.C.
J0J2G0;45.222793;-73.22365569999999;515, rang Grand-Sabrevois, Sabrevois, QC J0J2G0;Ferme Belnoy Inc.
J0J1W0;45.2161953;-73.30785999999999;2015 Principale Street, Saint-Blaise-sur-Richelieu, QC J0J1W0;Ferme Bergenire inc
J0H2E0;45.6629028;-72.68311709999999;443, rang de la Carrire, Upton, QC J0H2E0;Ferme Bernerhof Inc
G0Z1A0;46.1741231;-72.2283194;934, 11e Rang, Aston-Jonction, QC G0Z1A0;Ferme Bibomeau Inc.
G0C3A0;48.1138238;-65.5469337;255 Du Viaduc Avenue, Saint-Simon, QC G0C3A0;Ferme Bourdages Tradition inc.
J0B1L0;45.2207021;-71.8009691;640, chemin de Hatley, Compton, QC J0B1L0;Ferme Breault et frres inc
J2T5J5;45.606316;-72.89893789999999;21600 Saint-Louis Avenue, Saint-Hyacinthe, QC J2T5J5;Ferme Bunny (9195-5922 Qc)
J5M1Y5;45.8681706;-73.7039271;95, ruisseau Saint-Jean, Saint-LinLaurentides, QC J5M1Y5;Ferme C.J. Duval Inc.
J0P1T0;45.3720521;-74.3840292;3755, 2e Rang, Sainte-Justine-de-Newton, QC J0P1T0;Ferme Cardinal et Fils senc
J0K1T0;45.9426911;-73.6298063;134, Grande Ligne, Saint-Alexis, QC J0K1T0;Ferme Carole et Gaston Wolfe
G0X1C0;46.4415518;-72.3868717;1396 Notre-Dame Street, RR1, Champlain, QC G0X1C0;Ferme Champlinoise
J0J1E0;45.1448409;-73.2171812;449, rang Saint-Louis, Henryville, QC J0J1E0;Ferme Chelcive senc
J6R2L1;45.2920054;-73.7226364;5A, rang Saint-Charles, Mercier, QC J6R2L1;Ferme Clement Roy inc
J0V1X0;45.57570920000001;-74.32270939999999;1790, chemin du Coteau-des-Htres, Saint-Andr-d'Argenteuil, QC J0V1X0;Ferme Cloutier et Frres senc
G6T0S9;46.1026223;-71.915571;108 Arthabaska Boulevard East, Victoriaville, QC G6T0S9;Ferme Comestar holstein inc.
J0S1G0;45.1572666;-73.88696879999999;1363, rang 5, Howick, QC J0S1G0;Ferme Craigal 1826 Inc.
H7J1C9;45.6786615;-73.7011785;3150 Des Mille-les Boulevard, Laval, QC H7J1C9;Ferme D.M.Sauriol SENC.
G8M3L3;48.9155582;-72.4852968;622, Grand Rang Nord, Albanel, QC G8M3L3;Ferme d'Albanel Inc.
G0A3W0;46.9362661;-70.9119103;1475, cte Blais, Saint-Jean-de-l'le-d'Orlans, QC G0A3W0;Ferme Daniel Blais inc.
J5W1G7;45.881538;-73.38968319999999;480, rang Point-du-Jour Nord, L'Assomption, QC J5W1G7;Ferme Daniel Martel
G8E1X5;48.6442121;-71.72964929999999;6381 Du Pont Nord Avenue, Alma, QC G8E1X5;Ferme Dani-Jean Inc.
G2A0A6;46.89488859999999;-71.4291758;3245 Richardson Street, Qubec, QC G2A0A6;Ferme de Reproduction James et Gordon Jack inc.
J0K2L0;45.91038940000001;-73.6758303;51, rang Rivire Nord, Saint-Esprit, QC J0K2L0;Ferme d'en Bas inc.
J0K2N0;46.2815443;-73.4018447;1900, rang Saint-Louis, Saint-Gabriel-de-Brandon, QC J0K2N0;Ferme Denis & Andr Morin Inc.
J7R0J6;45.5601828;-73.9621741;654, Rivire Nord, Saint-Eustache, QC J7R0J6;Ferme Denis Prud'homme Inc.
J0P1Y0;45.3006737;-74.4238797;2716, 6e Rang, Saint-Tlesphore, QC J0P1Y0;Ferme des Flandres 1985 Enr.
J0G1J0;46.0881522;-72.77597329999999;175, rang du Chenal-Tardif, Pierreville, QC J0G1J0;Ferme des Ormes S.E.N.C.
G0R2R0;47.1603771;-70.177554;325, route du Lac-Trois-Saumons, Saint-Aubert, QC G0R2R0;Ferme des Penses Sauvages
G0L3M0;48.0070223;-68.996627;610, rang de la Rallonge Ouest, Saint-Jean-de-Dieu, QC G0L3M0;Ferme des Ti-Ct inc.
G0A3G0;46.78847349999999;-71.8220877;928, chemin de la Station, Sainte-Basile, QC G0A3G0;Ferme Dony inc
G0S2H0;46.6146857;-71.7364984;5460, route Marie-Victorin, Sainte-Croix, QC G0S2H0;Ferme du Doc inc.
G9P5G6;46.4766701;-72.7490507;4500, rang Saint-Michel, Shawinigan, QC G9P5G6;Ferme du Domaine 2000 inc.
G0J1C0;48.7114564;-67.8483514;194, route 132, Baie-des-Sables, QC G0J1C0;Ferme du Littoral inc.
G0S1K0;46.2755892;-71.54892110000002;206, rang 11, Inverness, QC G0S1K0;Ferme Fiset Lyster Inc (2731-4822 Qc. inc.)
G3H1S3;46.74164649999999;-71.73479499999999;51, rang de l'Enfant-Jsus, Pont-Rouge, QC G3H1S3;Ferme Floroma Inc
G6L3R3;46.21388289999999;-71.7771126;1267 Laurendeau Street, Plessisville, QC G6L3R3;Ferme forestire R. Marcoux Inc.
G0N1B0;46.0026427;-71.335446;628, route Alphe, Saint-Julien, QC G0N1B0;Ferme Fran-cler senc
J0K2R0;45.9749901;-73.58367989999999;2040, rang des Continuations, Saint-Jacques, QC J0K2R0;Ferme Franois Gagnon
J7N2Z3;45.5761876;-74.2230581;2074, chemin Lalande, Mirabel, QC J7N2Z3;Ferme Franot
G0N1P0;46.3110134;-70.9966379;2313 Principale Street, Saint-Frdric, QC G0N1P0;Ferme G.E.C. inc.
J0G1W0;46.0214335;-72.9480489;231, rang du Bord-de-l'Eau Ouest, Yamaska, QC J0G1W0;Ferme Genlouis Inc
J7N3A1;45.5698668;-74.0381708;12150, rang de la Fresnire, Mirabel, QC J7N3A1;Ferme Grard Renaud
G0Z1J0;46.1758833;-72.3319839;555, 8e Rang, Saint-Wenceslas, QC G0Z1J0;Ferme Girelou Inc.
J0K1S0;46.06548799999999;-73.7340588;1305, chemin Lalibert, Rawdon, QC J0K1S0;Ferme Guy Rivest
G0L2X0;47.9100698;-69.3034389;433, rang A, Saint-piphane, QC G0L2X0;Ferme Hec-Bert Inc
J6S0E7;45.2782691;-74.10281049999999;140, rang du Milieu, Salaberry-de-Valleyfield, QC J6S0E7;Ferme Hubert Sauv
J0J1B0;45.0567848;-73.27020639999999;514, route 225 Sud, Noyan, QC J0J1B0;Ferme Imperiale SENC.
J0P1B0;45.3055027;-74.1845488;74, route 201, Coteau-du-Lac, QC J0P1B0;Ferme Isabelle Inc.
G0X2X0;46.4837413;-72.52857879999999;2611, rang Sainte-Marguerite, Saint-Maurice, QC G0X2X0;Ferme J. Veillette Inc.
J5T3P8;45.911185;-73.38387299999999;154, rang Point-du-Jour Nord, Lavaltrie, QC J5T3P8;Ferme J.C. Auclair Inc.
J0H1M0;45.7317366;-72.7497417;489, 3e Rang, Sainte-Hlne, QC J0H1M0;Ferme J.M. Puppynck inc.
G0R2T0;46.7612908;-70.9456661;9195, route 279, Saint-Charles, QC G0R2T0;Ferme Jarold Inc.
G2G0G4;46.7773323;-71.4379021;1600, rang Saint-Denis, Qubec, QC G2G0G4;Ferme Jean Deschenes Inc.
J3T1T5;46.2003874;-72.6437164;165, rang Saint-Alexis, Nicolet-Sud, QC J3T1T5;Ferme Jronico inc.
J0H1W0;45.5078946;-72.87461929999999;1618, rang Haut-de-la-Rivire Sud, Saint-Pie, QC J0H1W0;Ferme JML Robert senc.
J5T4B2;45.9208717;-73.36491169999999;10, traverse de la Savane, Lavaltrie, QC J5T4B2;Ferme JPMA Goyette (9184-2963 Qubec inc)
G0L1G0;47.9404124;-69.4656016;1303 Du Patrimoine Street, Cacouna, QC G0L1G0;Ferme Kakou SENC
J0K1C0;46.0723764;-73.58059609999999;321, rang Kildare, Saint-Ambroise-de-Kildare, QC J0K1C0;Ferme Kildare
G0X2G0;46.7297502;-72.38689149999999;140, rang Price, Saint-Adelphe-de-Champlain, QC G0X2G0;Ferme L. & J. Gagnon
J0J2B0;45.22825659999999;-73.0057365;160, rang Campbell, Sainte-Sabine, QC J0J2B0;Ferme L.Campbell & Fils Inc.
J0B1P0;45.0567947;-71.74428899999999;105, chemin Stanhope-Baldwin, Dixville, QC J0B1P0;Ferme L.G. Bgin SENC
G0S2A0;46.38511159999999;-71.43280949999999;1020, rang Bois-Franc, Sainte-Agathe-de-Lotbinire, QC G0S2A0;Ferme Laitire du Village inc.
G0L1M0;47.5398156;-69.85560359999999;297, rang Haute-Ville, Kamouraska, QC G0L1M0;Ferme Laitire Rayon d'Or
J0A1E0;45.9064604;-72.1841634;1150, 7e Rang Petit, Saint-Albert, QC J0A1E0;Ferme Landrynoise inc.
G0R2V0;46.5869053;-70.8633483;100, route Sainte-Caroline, Sainte-Claire, QC G0R2V0;Ferme le Versant fruitier Senc.
J0S1M0;45.11337899999999;-74.31915669999999;1935, chemin Smith, Saint-Anicet, QC J0S1M0;Ferme Legermau 2000 inc.
G6L4K4;46.14193350000001;-71.8318297;8, 12e Rang Est, Princeville, QC G6L4K4;Ferme Lgil Inc.
G0A1L0;46.7036283;-71.79209729999999;65, rang Saint-Franois Est, Cap-Sant, QC G0A1L0;Ferme Lo Jacobs et fils Inc.
J5M2A2;45.8457855;-73.77598879999999;1266, rang de la Rivire Sud, Saint-LinLaurentides, QC J5M2A2;Ferme Lidom Inc.
G0R1P0;47.0652516;-70.5386343;294, chemin du Roi, L'Isle-aux-Grues, QC G0R1P0;Ferme Lilogru Inc.
J7R0E2;45.5483542;-73.9598187;720, chemin de la Rivire Sud, Saint-Eustache, QC J7R0E2;Ferme Louis & Francine Charbonneau s.e.n.c.
G0S2G0;46.4974837;-71.1560334;436, rang Saint-Mathieu, Saint-Bernard, QC G0S2G0;Ferme Marcel Nadeau & Frres Inc.
G7A2N3;46.67832019999999;-71.42893289999999;1344, chemin Saint-Joseph, Saint-Nicolas, QC G7A2N3;Ferme Mireille et Clment Gosselin
G0S1H0;46.4780797;-71.5131931;25, route 116 Est, Dosquet, QC G0S1H0;Ferme Moffette inc.
G0K1L0;48.4914823;-68.2202535;207, 6e Rang Ouest, Saint-Donat, QC G0K1L0;Ferme Mont Comi (2962-4343 Qc inc.)
G6G6K8;46.0836041;-71.3621907;1363 Frontenac Boulevard West, Thetford Mines, QC G6G6K8;Solutions E'Mind Tek inc.
A1E6A3;   Looking up postal code: A1E 6A3 (API call #1)
     TURBO MODE: Trying Google Geocoding API first...
     Found coordinates: 47.5060913
47.5060913
     TURBO MODE: Trying Google Geocoding API first...
-52.78281819999999 (source: Google-Turbo)
-52.78281819999999;   Looking up postal code: A1E 6A3 (API call #1)
     TURBO MODE: Trying Google Geocoding API first...
     Found coordinates: 47.5060913
   Looking up postal code: A1E 6A3 (API call #1)
     TURBO MODE: Trying Google Geocoding API first...
-52.78281819999999 (source: Google-Turbo)
-52.78281819999999;St. John's, NL A1E 6A3;Avalla Construction Inc.
A0J1T0;   Looking up postal code: A0J 1T0 (API call #1)
     TURBO MODE: Trying Google Geocoding API first...
     Found coordinates: 49.28183989999999
49.28183989999999
     TURBO MODE: Trying Google Geocoding API first...
-55.6973315 (source: Google-Turbo)
-55.6973315;   Looking up postal code: A0J 1T0 (API call #1)
     TURBO MODE: Trying Google Geocoding API first...
     Found coordinates: 49.28183989999999
   Looking up postal code: A0J 1T0 (API call #1)
     TURBO MODE: Trying Google Geocoding API first...
-55.6973315 (source: Google-Turbo)
-55.6973315;Springdale, NL A0J 1T0;Bojo's Restaurants Inc.
A1L1K9;   Looking up postal code: A1L 1K9 (API call #1)
     TURBO MODE: Trying Google Geocoding API first...
     Found coordinates: 47.5360313
47.5360313
     TURBO MODE: Trying Google Geocoding API first...
-52.9007142 (source: Google-Turbo)
-52.9007142;   Looking up postal code: A1L 1K9 (API call #1)
     TURBO MODE: Trying Google Geocoding API first...
     Found coordinates: 47.5360313
   Looking up postal code: A1L 1K9 (API call #1)
     TURBO MODE: Trying Google Geocoding API first...
-52.9007142 (source: Google-Turbo)
-52.9007142;Paradise, NL A1L 1K9;CG Aberdeen Holdings Inc
A1E2C2;   Looking up postal code: A1E 2C2 (API call #1)
     TURBO MODE: Trying Google Geocoding API first...
     Found coordinates: 47.5324088
47.5324088
     TURBO MODE: Trying Google Geocoding API first...
-52.7537517 (source: Google-Turbo)
-52.7537517;   Looking up postal code: A1E 2C2 (API call #1)
     TURBO MODE: Trying Google Geocoding API first...
     Found coordinates: 47.5324088
   Looking up postal code: A1E 2C2 (API call #1)
     TURBO MODE: Trying Google Geocoding API first...
-52.7537517 (source: Google-Turbo)
-52.7537517;St.John's, NL A1E 2C2;City Light Holdings Inc.
A1B2M4;   Looking up postal code: A1B 2M4 (API call #1)
     TURBO MODE: Trying Google Geocoding API first...
     Found coordinates: 47.58225119999999
47.58225119999999
     TURBO MODE: Trying Google Geocoding API first...
-52.7136924 (source: Google-Turbo)
-52.7136924;   Looking up postal code: A1B 2M4 (API call #1)
     TURBO MODE: Trying Google Geocoding API first...
     Found coordinates: 47.58225119999999
   Looking up postal code: A1B 2M4 (API call #1)
     TURBO MODE: Trying Google Geocoding API first...
-52.7136924 (source: Google-Turbo)
-52.7136924;St. John's, NL A1B 2M4;Connie Parsons School Of Dance
A1N0A1;   Looking up postal code: A1N 0A1 (API call #1)
     TURBO MODE: Trying Google Geocoding API first...
     Found coordinates: 47.5028714
47.5028714
     TURBO MODE: Trying Google Geocoding API first...
-52.8084862 (source: Google-Turbo)
-52.8084862;   Looking up postal code: A1N 0A1 (API call #1)
     TURBO MODE: Trying Google Geocoding API first...
     Found coordinates: 47.5028714
   Looking up postal code: A1N 0A1 (API call #1)
     TURBO MODE: Trying Google Geocoding API first...
-52.8084862 (source: Google-Turbo)
-52.8084862;Mount Pearl, NL A1N 0A1;DOF Subsea Canada Corp.
A0K1B0;   Looking up postal code: A0K 1B0 (API call #1)
     TURBO MODE: Trying Google Geocoding API first...
     Found coordinates: 49.900264
49.900264
     TURBO MODE: Trying Google Geocoding API first...
-56.1695054 (source: Google-Turbo)
-56.1695054;   Looking up postal code: A0K 1B0 (API call #1)
     TURBO MODE: Trying Google Geocoding API first...
     Found coordinates: 49.900264
   Looking up postal code: A0K 1B0 (API call #1)
     TURBO MODE: Trying Google Geocoding API first...
-56.1695054 (source: Google-Turbo)
-56.1695054;Baie Verte, NL A0K 1B0;EMC Enterprises Inc.
A1B1V1;   Looking up postal code: A1B 1V1 (API call #1)
     TURBO MODE: Trying Google Geocoding API first...
     Found coordinates: 47.56470299999999
47.56470299999999
     TURBO MODE: Trying Google Geocoding API first...
-52.7380609 (source: Google-Turbo)
-52.7380609;   Looking up postal code: A1B 1V1 (API call #1)
     TURBO MODE: Trying Google Geocoding API first...
     Found coordinates: 47.56470299999999
   Looking up postal code: A1B 1V1 (API call #1)
     TURBO MODE: Trying Google Geocoding API first...
-52.7380609 (source: Google-Turbo)
-52.7380609;St. John's, NL A1B 1V1;F.D.A. Enterprises Ltd.
A0K2P0;   Looking up postal code: A0K 2P0 (API call #1)
     TURBO MODE: Trying Google Geocoding API first...
     Found coordinates: 51.4475663
51.4475663
     TURBO MODE: Trying Google Geocoding API first...
-56.96300429999999 (source: Google-Turbo)
-56.96300429999999;   Looking up postal code: A0K 2P0 (API call #1)
     TURBO MODE: Trying Google Geocoding API first...
     Found coordinates: 51.4475663
   Looking up postal code: A0K 2P0 (API call #1)
     TURBO MODE: Trying Google Geocoding API first...
-56.96300429999999 (source: Google-Turbo)
-56.96300429999999;Forteau, NL A0K 2P0;Forteau Sales & service
A1N4S7;   Looking up postal code: A1N 4S7 (API call #1)
     TURBO MODE: Trying Google Geocoding API first...
     Found coordinates: 47.5122465
47.5122465
     TURBO MODE: Trying Google Geocoding API first...
-52.84704970000001 (source: Google-Turbo)
-52.84704970000001;   Looking up postal code: A1N 4S7 (API call #1)
     TURBO MODE: Trying Google Geocoding API first...
     Found coordinates: 47.5122465
   Looking up postal code: A1N 4S7 (API call #1)
     TURBO MODE: Trying Google Geocoding API first...
-52.84704970000001 (source: Google-Turbo)
-52.84704970000001;Mount Pearl, NL A1N 4S7;Genoa Design International Ltd
A1B1R4;   Looking up postal code: A1B 1R4 (API call #1)
     TURBO MODE: Trying Google Geocoding API first...
     Found coordinates: 47.579752
47.579752
     TURBO MODE: Trying Google Geocoding API first...
-52.715552 (source: Google-Turbo)
-52.715552;   Looking up postal code: A1B 1R4 (API call #1)
     TURBO MODE: Trying Google Geocoding API first...
     Found coordinates: 47.579752
   Looking up postal code: A1B 1R4 (API call #1)
     TURBO MODE: Trying Google Geocoding API first...
-52.715552 (source: Google-Turbo)
-52.715552;St. John's, NL A1B 1R4;Goulds Foods Inc.
A5A1K5;   Looking up postal code: A5A 1K5 (API call #1)
     TURBO MODE: Trying Google Geocoding API first...
     Found coordinates: 48.1637276
48.1637276
     TURBO MODE: Trying Google Geocoding API first...
-53.9870622 (source: Google-Turbo)
-53.9870622;   Looking up postal code: A5A 1K5 (API call #1)
     TURBO MODE: Trying Google Geocoding API first...
     Found coordinates: 48.1637276
   Looking up postal code: A5A 1K5 (API call #1)
     TURBO MODE: Trying Google Geocoding API first...
-53.9870622 (source: Google-Turbo)
-53.9870622;Clarenville, NL A5A 1K5;Leeward Enterprises
A1E6J4;   Looking up postal code: A1E 6J4 (API call #1)
     TURBO MODE: Trying Google Geocoding API first...
     Found coordinates: 47.5146902
47.5146902
     TURBO MODE: Trying Google Geocoding API first...
-52.77361510000001 (source: Google-Turbo)
-52.77361510000001;   Looking up postal code: A1E 6J4 (API call #1)
     TURBO MODE: Trying Google Geocoding API first...
     Found coordinates: 47.5146902
