Postal Code;Latitude;Longitude;Sample Address;Sample Employer
H4S1T2;45.4962171;-73.7437181;2705 Pitfield Boulevard, Suite200, Montreal, QC H4S1T2;Altitude Aerospace
J0B3A0;45.3341077;-71.4910788;275, chemin Laberee, Sawyerville (Cookshire-Eaton), QC J0B3A0;Amanda-Joe Plantations
H2Y1S6;45.5053399;-73.55597969999999;204 Saint-Sacrement Street, Suite300, Montreal, QC H2Y1S6;Amaris Conseil Inc.
H9R1C8;45.4580317;-73.8342679;7600 Trans-Canada Highway, Pointe-Claire, QC H9R1C8;AMAYA INC.
H2H2N2;45.5399311;-73.5633222;4303 Hogan Street, Montreal, QC H2H2N2;Amnagement Ct Jardin Inc.
H7E1S3;45.5916446;-73.6767512;1105, monte Masson, Laval, QC H7E1S3;Amnagement Denis et Fils Inc.
J9H1A1;45.3952508;-75.83384509999999;204, chemin d'Aylmer, Suite304, Gatineau, QC J9H1A1;Ammex Impots Income Tax Ltd
J0H1J0;45.5306996;-73.0233535;231, rang Saint-Louis, Saint-Damase, QC J0H1J0;Andr et Dominic Palardy
H9R1B9;45.4657184;-73.8185695;6100 Trans-Ccanada Highway, Pointe-Claire, QC H9R1B9;Andritz Hydro Canada inc.
J6S6J2;45.2921416;-74.06521339999999;4225 Hbert Boulevard, Salaberry-de-Valleyfield, QC J6S6J2;Andy Transport Inc.
H2R3A4;45.53160159999999;-73.62237290000002;7520 Du Mile-End Street, Montreal, QC H2R3A4;Apcurium Group
H4T1E3;45.4845659;-73.69083259999999;6550, chemin de la Cte-de-Liesse, 2ndFloor, Saint-Laurent, QC H4T1E3;APECQ
H3C2N4;45.4978197;-73.55727829999999;279 Prince Street, Montreal, QC H3C2N4;AppDirect Canada inc.
H1V2C8;45.5506934;-73.54291929999999;2030 Pie-IX Boulevard, Suite208, Montreal, QC H1V2C8;Aptitude X inc.
H3L2R5;45.5459836;-73.6595524;9805 Clark Street, Montreal, QC H3L2R5;Aquabrass Inc
J6J3N7;45.3664455;-73.7266456;275 Flanagan Street, Chteauguay, QC J6J3N7;Arclay Technologies Naturelles inc.
H3W2L2;45.4878919;-73.6197244;4848 Roselyn Avenue, Montreal, QC H3W2L2;Ardene
H4P2A2;45.502858;-73.6640329;2445, chemin Duncan, Mont-Royal, QC H4P2A2;Arrival Air & Sea Transport Inc.
G0R3G0;47.203874;-70.2504756;909, cte Saint-Aubert, PO Box924, Saint-Jean-Port-Joli, QC G0R3G0;Art Massif Structure de bois inc
H7S2K1;45.5670447;-73.7358126;1816 Le Corbusier Boulevard, Laval, QC H7S2K1;Artemano Canada Inc.
H2M1L9;45.54839459999999;-73.6367882;633 Crmazie Boulevard East, Suite100, Montreal, QC H2M1L9;Association de Montreal pour la Dficience Intellectuelle
H2W1T2;45.5167964;-73.58701929999999;4373 De l'Esplanade Avenue, Montreal, QC H2W1T2;Association d'Entraide Le Chanon inc.
J7C1V3;45.6814043;-73.88132539999999;1093 Des Pins Street, Blainville, QC J7C1V3;Association Legit-Quebec
H4N2L3;45.5112836;-73.6689172;395 Sainte-Croix Avenue, Suite200, Saint-Laurent, QC H4N2L3;Assystem Canada Inc.
G1P4M9;46.8007216;-71.2932462;340 Galile Avenue, Qubec, QC G1P4M9;Atelier d'usinage Mgatech AQ inc.
G0Z1K0;46.1558358;-72.02300200000001;219, rang 6, Saint-Rosaire, QC G0Z1K0;Atobec Inc
G8L1E5;48.8619619;-72.21629589999999;277 Walberg Boulevard, Dolbeau-Mistassini, QC G8L1E5;Atocas Lac St-Jean Inc.
G0P1L0;46.1567639;-71.7269428;136, route165, Sainte-Sophie-d'Halifax, QC G0P1L0;Atocas Notre Dame inc.
G0S1P0;46.3078387;-71.6835205;349, rang4, Laurierville, QC G0S1P0;Atocas St-Louis Inc.
H3A2J5;45.5072748;-73.5701246;2050 De Bleury Street, Suite800, Montreal, QC H3A2J5;Atomic Fiction
H2T3B3;45.5277495;-73.5966901;5455 De Gasp Avenue, Suite804, Montreal, QC H2T3B3;Attraction images productions II inc.
J0E1E0;45.3480035;-72.9053591;523, rang Sraphine, Ange-Gardien, QC J0E1E0;Au Jardin Noir
J7J1Z9;45.6633283;-73.96999149999999;11000, rang Sainte-Henriette, Mirabel, QC J7J1Z9;Au pays des Petits Fruits senc
J0K3B0;46.8885229;-74.1063753;1200, chemin de la Baie-du-Milieu, Saint-Michel-des-Saints, QC J0K3B0;Auberge du Lac Taureau
H2Y2Z9;45.5064497;-73.5542773;426 Saint-Gabriel Street, Montreal, QC H2Y2Z9;Auberge St-Gabriel
H2Y2P4;45.5023589;-73.5562738;409 Saint-Nicolas Street, Suite300, Montreal, QC H2Y2P4;Audiokinetic Inc
G5A1C5;47.6792169;-70.1787106;544, chemin de la Valle, La Malbaie, QC G5A1C5;Aurel Harvey & Fils Inc.
H3C2L7;45.4952727;-73.55333820000001;10 Duke Street, Montreal, QC H3C2L7;Autodesk Canada Co.
H2Y3X7;45.50228629999999;-73.5601382;380 Saint-Antoine Street West, Suite7000, Montreal, QC H2Y3X7;Automic
J0P1X0;45.3048764;-74.3164958;3150, chemin de l'glise, Saint-Polycarpe, QC J0P1X0;Aux Aubpines 2002 inc.
G6E3A7;46.4314712;-71.0466328;1720, route du Prsident-Kennedy Sud, Sainte-Marie, QC G6E3A7;Aux fruits de la colline
J9J2Y9;45.4266461;-75.89094540000001;398 Eardley Street, Gatineau, QC J9J2Y9;Aux Fruits des Champs senc
J0K2E0;46.3473696;-73.513673;1898, chemin Beauparlant Ouest, Saint-Damien, QC J0K2E0;AUX JARDINS DE LA BERGRE
H1J2E8;45.6133484;-73.58673089999999;10925 Louis-H.-La Fontaine Boulevard, Montreal, QC H1J2E8;Axium Robotic et Automation ULC
J0K3H0;45.8563666;-73.6399492;605, rang de la Rivire Sud, Saint-Roch-de-l'Achigan, QC J0K3H0;B Cousineau & Fils S.E.N.C
H2L1L9;45.5225363;-73.56515259999999;1210 Sherbrooke Street East, Montreal, QC H2L1L9;Ballets Jazz De Montreal(Les)
H4A1E2;45.4753232;-73.62340309999999;5645 De Monkland Avenue, Montreal, QC H4A1E2;Bangkok Express
H3B4L2;45.5017949;-73.5637261;600 De La Gauchetire Street West, Montreal, QC H3B4L2;Banque Nationale du Canada
H3B3B5;45.5004996;-73.5639146;700 De La Gauchetire Street West, Montreal, QC H3B3B5;Banque Nationale du Canada
H3A1N9;45.50647619999999;-73.5685541;425 Mayor Street, Montreal, QC H3A1N9;Bar Furco
J3B6X8;45.30655549999999;-73.2508493;242 Richelieu Street, Saint-Jean-sur-Richelieu, QC J3B6X8;Bastos Restaurant Inc.
J1S0A4;45.5826199;-72.00068109999999;110 J.-E.-Lemieux Street, Windsor, QC J1S0A4;Baultar Concept Inc.
H3A3L6;45.5026902;-73.5751837;1002 Sherbrooke Street West, Suite1600, Montreal, QC H3A3L6;BCA Research Inc.
G1K3H3;46.8131966;-71.22493369999999;305 Charest Boulevard East, Suite700, Qubec, QC G1K3H3;Beenox inc.
H3A1L2;45.5058793;-73.56937739999999;416 De Maisonneuve Boulevard West, Suite600, Montreal, QC H3A1L2;Behaviour Interactif Inc.
H3E3B3;45.4724268;-73.5424452;1, carrefour Alexander-Graham-Bell, Verdun, QC H3E3B3;Bell Canada
G0X2R0;46.5356969;-72.35508999999999;97, rang des Forges, Sainte-Genevive-de-Batiscan, QC G0X2R0;Benjoporc inc.
J8X3P1;45.4434963;-75.71467779999999;15 Fournier Boulevard, Gatineau, QC J8X3P1;BEST Linen Supply & Service Limited
G5R1E2;47.8272127;-69.55495689999999;171 Fraser Street, Rivire-du-Loup, QC G5R1E2;Best Western plus Htel Levesque
H3C2M1;45.4969822;-73.5567259;111 Duke Street, Suite3600, Montreal, QC H3C2M1;Beyond Technologies Consulting Inc./SOLUTIONS BEYOND TECHNOLOGIES INC.
H4P1Z8;45.4993023;-73.6547276;4996, place de la Savane, Montreal, QC H4P1Z8;BG Communications
J7J0G2;45.6951635;-73.93099080000002;18005 Lapointe Street, Suite105, Mirabel, QC J7J0G2;Biesse Canada Inc
H2N1A3;45.5422699;-73.65744099999999;105 De Louvain Street West, Montreal, QC H2N1A3;Big Bang ERP Inc.
H4C1H1;45.48232;-73.58441890000002;3451 Saint-Jacques Street West, Montreal, QC H4C1H1;Billions Productions (Muse) Inc.
G1V0B9;46.76775310000001;-71.28895919999999;2828 Laurier Boulevard, Suite700, Qubec, QC G1V0B9;BIM One
J1M1Z8;45.3675346;-71.84303299999999;80, chemin Moulton Hill, Sherbrooke, QC J1M1Z8;Bishop's college school
G0G1J0;52.5373228;-68.9231712;17 De Brouage Street, Fermont, QC G0G1J0;Blackburn Quartz Inc..(9112-3760 Quebec Inc.)
G0R2N0;46.6315549;-71.0062705;435, rang Saint-Pierre, Saint-Anselme, QC G0R2N0;Blais productions inc.
G0W2L0;48.4633298;-71.6207122;698 Melanon Street, Saint-Bruno, QC G0W2L0;Bleuetire du Montreuil
J5T3P4;45.8814095;-73.36428789999999;330, rang Point-du-Jour Sud, Lavaltrie, QC J5T3P4;Bleuetire Point du Jour
H3A2W8;45.5034362;-73.57280729999999;1981 McGill College Avenue, Montreal, QC H3A2W8;BNP Paribas
H4S1Y9;45.4703518;-73.73002439999999;400, chemin de la Cte-Vertu Ouest, Dorval, QC H4S1Y9;Bombardier Aronautique
H3B1Y8;45.5006893;-73.56699549999999;800 Ren-Lvesque Boulevard West, 29th Floor, Montreal, QC H3B1Y8;Bombardier Inc.
J3V6E6;45.5263555;-73.36984679999999;1101 Parent Street, Saint-Bruno, QC J3V6E6;Bombardier Transportation Canada Inc.
J0J1A0;45.1076092;-72.9721729;16 Champagnat Street, Bedford, QC J0J1A0;Bonduelle Canada Inc Division Bedford
J0H1K0;45.7534518;-73.1456834;540, chemin des Patriotes, Saint-Denis-sur-Richelieu, QC J0H1K0;Bonduelle Canada inc. (St-Denis)
J0L1T0;45.39850819999999;-72.9824364;1055, route 112, Saint-Csaire, QC J0L1T0;Bonduelle Canada Inc. Division Saint-Csaire
G5V2P4;46.9735646;-70.5526393;275 Boss Avenue, Montmagny, QC G5V2P4;Boss et Frre Inc.
H2S1K6;45.5326354;-73.610879;65 Saint-Zotique Street East, Montreal, QC H2S1K6;Bottega Pizzeria
H2W1H1;45.51800009999999;-73.5782483;130 Duluth Avenue East, Montreal, QC H2W1H1;Boucherie et Epicerie Soares & Fils Inc.
H4E3G3;45.4523829;-73.59452809999999;6674 Beaubien Street, Montreal, QC H4E3G3;Boulangerie Et Ptisserie Riviera
G1V4T3;46.773219;-71.2828772;2600 Laurier Boulevard, Suite65, Qubec, QC G1V4T3;Boulangerie La Mre Michle inc.
G0C2L0;48.5146689;-64.2569541;194, route 132 Ouest, Perc, QC G0C2L0;Boulangerie Le Fournand
H2X2V7;45.5150908;-73.57441430000002;3715 Saint-Laurent Boulevard, Montreal, QC H2X2V7;Boutique Crazy Halloween / LOL Party Center
G0X2J0;46.5914819;-72.2064433;794, 2e Avenue, Sainte-Anne-de-la-Prade, QC G0X 2J0;Bovibec
H2V1V7;45.5202647;-73.60878959999999;1249 Bernard Avenue West, Montreal, QC H2V1V7;Brasserie Bernard
H3W1M6;45.4891258;-73.6368732;5151, cte Sainte-Catherine, Montreal, QC H3W1M6;Bronfman Jewish Education Centre
J0E2L0;45.4939538;-72.3514558;565 De La Montagne Street, Valcourt, QC J0E2L0;BRP inc.
J0X2Y0;45.623026;-76.5424941;25, chemin Stewart, Shawville, QC J0X2Y0;Bryson Farms
J4L4T4;45.5190243;-73.4374638;3688 Campeau Street, Longueuil, QC J4L4T4;BTT Canada
H2T2S6;45.5195292;-73.5873459;55 Mont-Royal Street West, Suite970, Montreal, QC H2T2S6;Budge Studios Inc. / studios Budge inc.
H2X2T6;45.513269;-73.5707769;3575 Saint-Laurent Boulevard, Suite500, Montreal, QC H2X2T6;BUF Canada Inc.
H3L1Z8;45.5403288;-73.66380989999999;400 Sauv Street West, Montreal, QC H3L1Z8;Buffalo International ULC
H2X2V2;45.5128875;-73.57139459999999;3518 Saint-Laurent Boulevard, Montreal, QC H2X2V2;Buona Notte Bar/Restaurant
H2T1X6;45.526409;-73.59580439999999;5425 Casgrain Avenue, Suite901, Montreal, QC H2T1X6;Busbud Inc.
J4P2J4;45.5019134;-73.51180979999999;482 Victoria Avenue, Saint-Lambert, QC J4P2J4;Buzztroop
J7N2V1;45.61964469999999;-74.06046619999999;7325, chemin Verdon, Mirabel, QC J7N2V1;C Et G Jett Inc.
H2X0A9;45.5106353;-73.555995;850 Saint-Denis Street, 5th Floor, Montreal, QC H2X0A9;C.H.U.M.
H4P2C7;45.50020139999999;-73.6587983;8225 Mayrand Street, Montreal, QC H4P2C7;C.R.H. Oral Design inc.
H3A1S5;45.4991408;-73.5713631;1411 Peel Street, Suite701, Montreal, QC H3A1S5;Caesars Interactive Entertainment Inc.
H2S3C7;45.532475;-73.61390449999999;6778 Saint-Laurent Boulevard, Montreal, QC H2S3C7;Caf Epoca
H2Z2B3;45.5032652;-73.56139259999999;1000, place Jean-Paul-Riopelle, Montreal, QC H2Z2B3;Caisse de dpt et placements du Qubec
H1Y1G4;45.5501022;-73.5907517;2597 Beaubien Street East, Montreal, QC H1Y1G4;Caisse desjardins de Rosemont-La Petite -Partie
J1X0E6;45.2823086;-72.1011262;2675 MacPherson Street, Magog, QC J1X0E6;Camoplast Solideal Inc.
G0X3J0;46.4565902;-72.6716266;1281, rang Saint-Flavien, Mont-Carmel, QC G0X3J0;Camping Paradiso Inc.
G0X2L0;46.5243151;-72.8530169;1850 Trudel Boulevard East, Saint-Boniface, QC G0X2L0;Camping St-Boniface inc
J7T1G1;45.3471682;-74.0862295;1215, monte Pilon, Les Cdres, QC J7T1G1;Canadian Helicopters Limited
H3B2M9;45.5008525;-73.56553839999999;935 De La Gauchetire Street West, Montreal, QC H3B2M9;Canadian National Railway Company o/a CN Railway
H3B1X9;45.5008164;-73.5676009;800 Ren-Lvesque Boulevard West, Suite410, Montreal, QC H3B1X9;Canadian Royalties Inc.
H2Y2G3;45.5003831;-73.5572308;407 McGill Street, Suite315, Montreal, QC H2Y2G3;CANADIAN WOOD PRODUCTS-MONTRAL INC
J0E1V0;45.1908631;-72.51611579999999;40, chemin du Centre, PO Box3430, Knowlton, QC J0E1V0;Canards du Lac Brome Lte
G0W1E0;48.9137322;-72.0310975;256 Principale Street, Sainte-Jeanne-d'Arc, QC G0W1E0;Canneberge JL inc.
J0C1N0;45.8870089;-72.3076428;3495, rang 4, Saint-Lucien, QC J0C1N0;Canneberges L & S SEC
G0S1T0;46.3110007;-71.82301529999999;633, rang Saint-Louis Ouest, Notre-Dame-de-Lourdes, QC G0S1T0;Canneberges Sakota inc
J5T3P2;45.9047509;-73.3571262;351, rang Point-du-Jour Sud, Lavaltrie, QC J5T3P2;Canneberges Schneider inc
H2Y1T9;45.5018085;-73.55869269999999;381 Notre-Dame Street, Suite200, Montreal, QC H2Y1T9;Cargomar Inc.
J0L1W0;45.1536621;-73.6642719;736, rang 3, Sainte-Clotilde, QC J0L1W0;Caropac inc.
H8R3H9;45.4349333;-73.646866;480 Lafleur Avenue, LaSalle, QC H8R3H9;Carpet Art Deco
J3B5L1;45.3101064;-73.2694508;360 Du Sminaire Boulevard, Suite9, Saint-Jean-sur-Richelieu, QC J3B5L1;Carrousel Auto Inc
H3A2A6;45.5044356;-73.5713805;2001 University Street, Suite1700, Montreal, QC H3A2A60;Casewise Canada Operations Inc.
H2V4A9;45.5190534;-73.597728;5100 Hutchison Street, Suite300, Montreal, QC H2V4A9;CAVALIA Inc
G9B0M1;46.3182518;-72.61686899999999;8095, chemin Sainte-Marguerite, Trois-Rivires, QC G9B0M1;Cdres Dupont Inc.
J5W3P4;45.8163057;-73.46750829999999;863, rang de la Presqu'le, L'Assomption, QC J5W3P4;Cdrire Del-Fino inc.
G0S2W0;46.5909018;-71.23624749999999;12 Napolon-Couture Street, Saint-Lambert-de-Lauzon, QC G0S2W0;Centre de dcoupe Mtal Bernard Inc.
H2H1T8;45.532319;-73.57378509999999;4400 Papineau Avenue, Montreal, QC H2H1T8;Centre de Mcanique et Pneus Papineau
G5C2L2;49.19333959999999;-68.26982169999999;1250 Lestrat Street, Baie-Comeau, QC G5C2L2;Centre De Protection Et De Readaptation De La Cote-Nord
H4B1R3;45.4587392;-73.63622909999999;7000 Sherbrooke Street West, Montreal, QC H4B1R3;Centre de Radaptation MAB-Mackay
H4B2M5;45.463705;-73.6273585;3333 Cavendish Boulevard, Suite100, Montreal, QC H4B2M5;Centre d'ducation Hanca (6413587 Canada inc.)
G5J3T5;48.4653988;-67.4315213;22 Du Pont Street, Suite2, Amqui, QC G5J3T5;Centre dentaire Stphan Lamarre
J8T6H1;45.48857719999999;-75.6985359;1124 Saint-Ren Boulevard West, Gatineau, QC J8T6H1;Centre dentaire Touchettes
J4G1Y6;45.5652905;-73.4717191;2165 De La Province Street, Longueuil, QC J4G1Y6;Centre d'information RX Lte
J7R0J2;45.57243;-73.9842779;920, monte Laurin, Saint-Eustache, QC J7R0J2;Centre du Jardin Deux-Montagnes Inc.
J7E2A9;45.6418384;-73.8535136;121 Saint-Charles Street, Sainte-Thrse, QC J7E2A9;Centre du Jardin Dion Inc.
J0R1H0;45.8987802;-74.27403439999999;93 Dwight Street, Morin-Heights, QC J0R1H0;Centre EauVie
J6V2H2;45.7245325;-73.50926559999999;911, monte des Pionniers, Terrebonne, QC J6V2H2;Centre Hospitalier Le Gardeur Inc
G1R2J6;46.815637;-71.2111572;11, cte du Palais, Qubec, QC G1R2J6;Centre Hospitalier Universitaire de Qubec
J1H5N4;45.4474194;-71.8688954;3001, 12e Avenue Nord, Sherbrooke, QC J1H5N4;Centre Hospitalier Universitaire de Sherbrooke
J8T4J3;45.4795129;-75.7240604;80 Gatineau Avenue, Gatineau, QC J8T4J3;Centre intgr de sant et de services sociaux de l'Outaouais (CISSSO)
G2G2P6;46.8062992;-71.3820738;1762, route de l'Aroport, Qubec, QC G2G2P6;Centre Jardin de l'Aroport inc
J7V8P5;45.4161999;-74.05716049999999;999 Saint-Charles Avenue, Vaudreuil-Dorion, QC J7V8P5;Centre Jardin Vaudreuil-Sur-Le-Lac inc
J2L3E7;45.3234258;-72.6435006;400 Shefford Street, Bromont, QC J2L3E7;Centre national de cyclique de Bromont
H3W1M7;45.488789;-73.6356079;5170, chemin de la Cte-Sainte-Catherine, Montreal, QC H3W1M7;Centre Segal / Segal Centre
G1N3Y3;46.8001397;-71.2601799;414 Saint-Sacrement Avenue, Qubec, QC G1N3Y3;Ceratec Inc.
H2J1H9;45.5347675;-73.5821881;1584 Laurier Avenue East, Montreal, QC H2J1H9;C'est la vie march bio
H2X1J2;45.5145323;-73.563958;5380 Bourret Avenue Montreal, QC H2X1J2;Chabad Lubavitch Youth Organization
H4T1E7;45.47856059999999;-73.69935649999999;7552, chemin de la Cte-de-Liesse, Ville Saint-Laurent, QC H4T1E7;Chag autosport
H2W1Z4;45.5188773;-73.58317579999999;4267 Saint-Laurent Boulevard, Suite300, Montreal, QC H2W1Z4;ChallengeU
J5R1B6;45.4022304;-73.51912;55 Marie-Victorin Boulevard, Candiac, QC J5R1B6;Chanel inc.
G1Y1S2;46.7502463;-71.34279889999999;1487 Provancher Street, Qubec, QC G1Y1S2;Chez Vanna Plus
G1J1Z4;46.8371449;-71.226169;1401, 18e Rue, Qubec, QC G1J1Z4;CHU De Qubec
H3T1C5;45.5032292;-73.6253461;3175, chemin de la Cte-Sainte-Catherine, Montreal, QC H3T1C5;CHU Sainte-Justine
G1L3L5;46.82775549999999;-71.2364135;10 De L'Espinay Street, Suite BO-526, Qubec, QC G1L3L5;CHUQ
G6W5M6;46.7423733;-71.2305401;1660 Guillaume-Couture Boulevard, Lvis, QC G6W5M6;Cibelye Import-Export inc.
J3Z1G8;45.46003899999999;-73.41508109999999;5400 J.-A.-Bombardier Street, Saint-Hubert, QC J3Z1G8;Cicame Energie Inc.
G0C1E0;48.0714344;-65.4528954;200, chemin Athanase-Arsenault, Bonaventure, QC G0C1E0;Cime Aventure
H2Y0A3;45.5032892;-73.56001739999999;250 Saint-Antoine Street West, Suite500, Montreal, QC H2Y0A3;Cinesite Inc.
J7V9R2;45.3937323;-74.05385939999999;3031 De La Gare Boulevard, Vaudreuil-Dorion, QC J7V9R2;Cisssmo-Csss Vaudreuil-Soulanges
H3B4Z9;45.5019427;-73.5667794;630 Ren-Lvesque Boulevard West, Suite1400, Montreal, QC H3B4Z9;CitiFinancial Canada Inc.
J4B7L9;45.5569965;-73.43525;1400 Joliot-Curie Street, Boucherville, QC J4B7L9;Claret Canada Inc.
J0B2C0;45.2948803;-71.9584538;80 Main Street, North Hatley, QC J0B2C0;Clinique Dentaire
H3P3H5;45.5226259;-73.62356819999999;1100 Beaumont Avenue, Suite201, Mont-Royal, QC H3P3H5;Clinique Laservue
H2C1R9;45.5615477;-73.6573307;1415 Fleury Street East, Montreal, QC H2C1R9;Clinique Physio 2000
H2R2E4;45.5395712;-73.61946669999999;7364 Saint-Denis Street, Montreal, QC H2R2E4;Clinique Vtrinaire St-Denis Inc.
H1Y2M1;45.5520912;-73.58318799999999;6101 8e Avenue, Montreal, QC H1Y2M1;Club Aquatique Rosemont-La-Petite-Patrie
J6X0B2;45.7389298;-73.71885829999999;3555, chemin Martin, Terrebonne, QC J6X0B2;Club de golf Terrebonne inc.
J4Y1C8;45.4549173;-73.46246119999999;7635 Malo Avenue, Brossard, QC J4Y1C8;Club de Judo Olympique
J8T0B4;45.482668;-75.68164059999999;850 De La Gappe Boulevard, Suite215, Gatineau, QC J8T0B4;Club de natation de Gatineau
J7Z5T7;45.7832005;-73.99043429999999;PO Box 4, Saint-Jrme, QC J7Z5T7;Club De Natation Neptune Inc.
J9H5E7;45.3949509;-75.83354629999999;203, chemin d'Aylmer, Gatineau, QC J9H5E7;Club de soccer d'Aylmer
J4J4J4;45.5341701;-73.47423069999999;2099 Laurier Street, Longueuil, QC J4J4J4;Club de Soccer de Longueuil
H9B2A7;45.483433;-73.80953389999999;120001 De Salaberry Boulevard, Dollard-des-Ormeaux, QC H9B2A7;Club de soccer Dollard
H4C1R2;45.4781685;-73.5839369;3975 Notre-Dame Street West, Montreal, QC H4C1R2;Club Gracie Barra Montreal
J4G1R9;45.5676897;-73.47155549999999;619 Le Breton Street, Longueuil, QC J4G1R9;Coalision inc.
H7L5X9;45.5837104;-73.77125359999999;"COBA, logiciels de gestion Inc","2130 Dagenais Boulevard West, Suite200, Laval, QC H7L5X9",1;COBA, logiciels de gestion Inc","2130 Dagenais Boulevard West, Suite200, Laval, QC H7L5X9",1
H3B4W5;45.4985836;-73.56630129999999;1000 De La Gauchetire Street West, Suite1500, Montreal, QC H3B4W5;Cofomo Inc.
H5A1M1;45.5004891;-73.5651247;800 De La Gauchetire Street West, Suite1100, Montreal, QC H5A1M1;Cogeco Diffusions Acquisitions inc.
J8X4B5;45.4258663;-75.72054360000001;25 Eddy Street, Suite100, Gatineau, QC J8X4B5;CogniVue Corporation
J7G2J2;45.62507009999999;-73.8308315;801 Cure-Boivin Boulevard, Boisbriand, QC J7G2J2;COH Inc.
H2G1Y9;45.5401557;-73.5843548;2050 Dandurand Street, Suite306, Montreal, QC H2G1Y9;Collections Girardin Inc
H3H2T8;45.4887305;-73.580353;2170 Ren-Lvesque Boulevard West, Montreal, QC H3H2T8;Collge des mdecins du Qubec
J7R6V6;45.5650269;-73.9071331;430 Arthur-Sauv Boulevard, Saint-Eustache, QC J7R6V6;Comm. Scolaire De La Seigneurie Des Mille Iles
H9B2H1;45.4906742;-73.7959501;92, chemin d'Avignon, Dollard-des-Ormeaux, QC H9B2H1;Commerce A & K Inc.
G6B1G6;45.5814405;-70.88703699999999;4730 Dollard Street, Lac-Mgantic, QC G6B1G6;Commission scolaire des Hauts-Cantons
J8C2C3;46.0482223;-74.28675369999999;13 Saint-Antoine Street, Sainte-Agathe-des-Monts, QC J8C2C3;Commission Scolaire Des Laurentides
G6Z2L4;46.7235;-71.2022819;912 Commerciale Street, PO Box 102, Suite100, Saint-Jean-Chrysostome, QC G6Z2L4;Comptition Hit The Floor
H1B1C4;45.6398425;-73.51455589999999;11700 Sherbrooke Street East, Montreal, QC H1B1C4;Complexe Kia Inc.
J5Z4X5;45.7551216;-73.4797375;418 Des Industries Street, Repentigny, QC J5Z4X5;Comptoir Agricole Ste-Anne inc.
H4C2Z6;45.4776617;-73.59281059999999;1001 Lenoir Street, SuiteB340, Montreal, QC H4C2Z6;COMPULSION GAMES
H2X1C2;45.51273510000001;-73.56920699999999;8 Sherbrooke Street East, Montreal, QC H2X1C2;Conception Focus
H3G1M8;45.4975451;-73.5790021;1455 De Maisonneuve Boulevard West, Montreal, QC H3G1M8;Concordia University
H3G1T4;45.4962169;-73.572041;1350 Ren-Lvesque Boulevard West, Montreal, QC H3G1T4;Conseillers en Gestion Informatique CGI Inc
H2S3C6;45.53090539999999;-73.6104313;6514 Saint-Laurent Boulevard, Montreal, QC H2S3C6;Construction D.G.F. Inc.
J7Y4P7;45.7624702;-74.02674259999999;170 Roland-Godard Boulevard, Saint-Jrme, QC J7Y4P7;Construction Demathieu Et Bard Inc
H2Y1A6;45.51224329999999;-73.55305559999999;810 Saint-Antoine Street East, Montreal, QC H2Y1A6;Construction Sant Montral
G1N4L5;46.7978485;-71.27439980000001;2022 Lavoisier Street, Suite125, Qubec, QC G1N4L5;Consulair
J3L6W4;45.4185629;-73.2902661;7920 Samuel-Hatt Street, Chambly, QC J3L6W4;Contrles Hemicycle Inc
J0L2N0;45.15337;-73.5317786;147, rang Saint-Paul, Sherrington, QC J0L2N0;Coop de Producteurs Multiveg Inc.
H2S2R9;45.5347462;-73.6072291;6690A Saint-Denis Street, Montreal, QC H2S2R9;Cordonnerie Dakissa
G9A5J9;46.3440259;-72.5434454;362 Bonaventure Street, PO Box 879, Trois-Rivires, QC G9A5J9;Corpo. piscopale Catholique romaine de Trois-Rivires
J4B5H2;45.5659022;-73.42995019999999;203 Newton Street, Suite1380, Boucherville, QC J4B5H2;Corporation Jamp Pharma
H3T1M2;45.4973586;-73.62320249999999;3515 Lacombe Avenue, Montreal, QC H3T1M2;Corporation JS Star Inc.
G1K3J3;46.8144315;-71.2220549;520 Charest Boulevard East, Suite330, Qubec, QC G1K3J3;Cortex
G0L2V0;48.03662019999999;-69.2070555;412, route de la Station, Saint-loi, QC G0L2V0;Cotech / XMtal (9091-4532 Qubec Inc.)
H9P2V4;45.4897713;-73.7700009;1255 Trans-Canada Highway, Suite200, Dorval, QC H9P2V4;Coty Canada Inc.
G0L1K0;48.0106479;-69.2888639;60 Seigneur-Ct Street, Isle-Verte, QC G0L1K0;Couvoir Dumont 1986 inc.
G2A2E1;46.86025919999999;-71.34809199999999;11605 De La Colline Boulevard, Qubec, QC G2A2E1;Couvoir Qubec inc
G1W2K7;46.7670464;-71.3088575;3175, chemin des Quatre-Bourgeois, Suite200, Quebec, QC G1W2K7;Coveo Solutions Inc.
H4S1Z1;45.4913008;-73.73072879999999;8455 Trans-Canada Highway, Saint-Laurent, QC H4S1Z1;Covidien Canada ULC
J4K5G4;45.5263563;-73.51956269999999;1111 Saint-Charles Street West, West Tower, Longueuil, QC J4K5G4;CRC Sogema Inc.
G6V4L2;46.8031953;-71.1808063;5825 Saint-Georges Street, Lvis, QC G6V4L2;Creaform Inc.
J1J1R4;45.4049446;-71.9228832;2030 Bretagne Street, Sherbrooke, QC J1J1R4;Crte Plantations
G6V3Z1;46.8155175;-71.1772606;143 Wolfe Street, Lvis, QC G6V3Z1;CSSS Alphonse-Desjardins
H4V2S7;45.4720126;-73.64587639999999;5425 Bessborough Street, Montreal, QC H4V2S7;CSSS Cavendish
J0T1T0;46.5161984;-74.9922655;1525 L'Annonciation Street North, Rivire-Rouge, QC J0T1T0;CSSS d'Antoine-Labelle/ CISSS des Laurentides
G7H5H6;48.4259412;-71.048935;305 Saint-Vallier Street, Chicoutimi, QC G7H5H6;Csss De Chicoutimi
G4V1X4;49.1179854;-66.4840981;50 Du Belvdre Street, Sainte-Anne-des-Monts, QC G4V1X4;CSSS de La Haute-Gaspsie
J9X2B2;48.2435793;-79.01938220000001;4, 9e Rue, Rouyn-Noranda, QC J9X2B2;CSSS de Rouyn-Noranda
J7Z5T3;45.7657721;-73.99996539999999;290 De Montigny Street, Saint-Jrme, QC J7Z5T3;CSSS de Saint-Jrme
G0L4K0;48.109021;-69.15167269999999;550 Notre-Dame Street East, Trois-Pistoles, QC G0L4K0;CSSS des Basques/ CH de Trois-Pistoles
J1T1X6;45.7718936;-71.9259196;475, 3e Avenue, Asbestos, QC J1T1X6;CSSS des Sources
G0C1K0;48.3681637;-64.6966942;451 Monseigneur-Ross Street, PO Box3300, Chandler, QC G0C1K0;CSSS du Rocher-Perc
H4G2A3;45.46416259999999;-73.5637497;4000 LaSalle Boulevard, Montreal, QC H4G2A3;CSSS du Sud-Ouest-Verdun
J8P7H2;45.49352380000001;-75.69138699999999;909 La Vrendrye Boulevard West, Gatineau, QC J8P7H2;CSSS Gatineau - Hull (CISSSO)
J6K4W8;45.3464429;-73.763565;200 Brisebois Boulevard, Chteauguay, QC J6K4W8;CSSS Jardins-Roussillon
G5V1Z9;46.9876715;-70.5405784;22 Ct Avenue, Montmagny, QC G5V1Z9;Csss Montgagny-L'islet
J2S4Y8;45.6346698;-72.9599456;2750 Laframboise Boulevard, Saint-Hyacinthe, QC J2S4Y8;CSSS Richelieu-Yamaska
J5T3P3;45.9222641;-73.3517497;190, rang Point-du-Jour Sud, Lavaltrie, QC J5T3P3;Cultures Georges Forest & Fils inc
G0A4L0;46.7940212;-72.28916959999999;295, route 363 Sud, Saint-Ubalde, QC G0A4L0;Cultures Quinto
G7K1G8;48.4061728;-71.1208633;1555 De La Manic Street, Chicoutimi, QC G7K1G8;Cycles Devinci inc.
H3A1L4;45.5064088;-73.56937909999999;400 De Maisonneuve Boulevard West, Suite500, Montreal, QC H3A1L4;D.F.S. INC.
J0R1R4;45.8919866;-74.17419029999999;433 Principale Street, Saint-Sauveur, QC J0R1R4;D2X Amrique du Nord Inc.
J0V2B0;45.54051279999999;-74.21008329999999;682, rang Saint-tienne, Saint-Placide, QC J0V2B0;Daniel Laviolette Paysagiste Inc
H2Y1N9;45.50214649999999;-73.55995899999999;393 Saint-Jacques Street West, Suite300, Montreal, QC H2Y1N9;Dassault Systmes Canada Inc.
H2Y2Y5;45.5058499;-73.55405549999999;407 Saint-Laurent Boulevard, Suite500, Montreal, QC H2Y2Y5;Datawind Inc.
H4P2L1;45.495678;-73.66970449999999;8315, chemin Devonshire, Mont-Royal, QC H4P2L1;DCM Group
J0J1L0;45.163537;-73.40604020000001;158, rang Grgoire, Napierville, QC J0J1L0;Delfland Inc
H3B4T9;45.5015297;-73.5685933;3, place Ville-Marie, Suite3000, Montreal, QC H3B4T9;Deloitte & Touche LLP - Montreal
H3B3B6;45.5031056;-73.56908989999999;1255 University Street, Suite450, Montreal, QC H3B3B6;Dempton Groupe Conseil
